UCL Q,Ludogorets vs FC Ballkani,Over 1.5,N/A,19:00,,2023-07-19,,N/A,ujrkbnjo293802970,venasbet_o_1_5
MLS,Philadelphia Lone Star vs West Chester Utd,Over 1.5,N/A,00:30,,2023-07-19,,N/A,uvlodnas200284417,venasbet_o_1_5
NOR,Lillestrom vs Aalesund,Over 1.5,N/A,17:00,,2023-07-19,,N/A,azcawsld241173289,venasbet_o_1_5
EGY,Al Ahly vs Haras El Hodood,Over 1.5,N/A,18:30,,2023-07-19,,N/A,csqquaeg84602937,venasbet_o_1_5
UCL Q,Qarabag (Aze) vs Lincoln Red Imps (Gib),Over 1.5,N/A,17:00,,2023-07-19,,N/A,qsfhrqel248035711,venasbet_o_1_5
EURO W,Czech Republic vs France,Over 1.5,N/A,N/A,0:1,2023-07-18,,Lost,klnveopl266548643,venasbet_o_1_5
UCL Q,TNS vs Hacken,Over 1.5,N/A,N/A,0:2,2023-07-18,,Won,thklyvrw102685279,venasbet_o_1_5
UCL Q,Maccabi Haifa vs Hamrun,Over 1.5,N/A,N/A,2:1,2023-07-18,,Won,jazswcpc56790903,venasbet_o_1_5
