SWI,Schaffhausen vs Stade Nyonnais,Over 1.5,1.45,19:30,,2024-12-13,,N/A,ojdsxxru45519157,bet99_overgoals
SWI,Schaffhausen vs Stade Nyonnais,Over 1.5,1.20,19:30,,2024-12-13,,N/A,nmhyuuqg156842640,bet99_overgoals
POR U23,Os Belenenses vs Covilha,Over 1.5,1.25,21:30,,2024-12-13,,N/A,shclxxeu205537554,bet99_overgoals
AUSLIA,Melbourne Victory W vs Wellington Phoenix W,Over 1.5,1.30,09:00,,2024-12-13,,N/A,pagwzwhg279413027,bet99_overgoals
BELG,Beveren vs K. Lierse S.K.,Over 1.5,1.20,20:00,,2024-12-13,,N/A,fmgmzsbv74608950,bet99_overgoals
POL DIV 1,Wisla vs Legnica,Over 1.5,1.25,21:00,1:1,2024-12-12,,N/A,bmetzhho140136068,bet99
BOL,SA Bulo Bulo vs Independiente,Over 1.5,1.30,20:00,3:1,2024-12-12,,N/A,hpqovoze246104713,bet99
TAN,Kinondoni MC vs Mashujaa,Over 1.5,1.35,20:15,0:0,2024-12-12,,N/A,evrtfeqb109121864,bet99
ind,East Bengal vs Odisha FC,Over 1.5,1.40,15:00,1:2,2024-12-12,,N/A,ovbngoac239440304,bet99
