CONMEBOL Libertadore..,Palmeiras vs Sporting Cristal,Draw(X),4.50,01:30,,2025-05-29,,N/A,trgzqkao187522134,bet99_draws
SE Division 2 - Västra..,Jonsered vs Qviding FIF,Draw(X),8.55,12:00,,2025-05-29,,N/A,hieuaycm110542966,bet99_draws
FI Suomen Cup,TPV vs KuPS,Draw(X),1.45,17:00,0:2,2025-05-28,,N/A,otuchaxm105458153,bet99_draws
AU Queensland NPL,St George Willawon.. vs Olympic,Draw(X),1.45,10:30,2:4,2025-05-28,,N/A,ukxmpbcr13911751,bet99_draws
SE Division 2 - Norrlan..,IFK Luleå vs Skellefteå,Draw(X),1.25,17:30,0:0,2025-05-28,,N/A,bxyknodx177081482,bet99_draws
EE Meistriliiga,FC Levadia Tallinn vs Vaprus,Draw(X),1.27,17:00,2:2,2025-05-28,,N/A,uygfytof29641202,bet99_draws
BR Brasileiro U20 A,Bahia U20 vs Fluminense U20,Draw(X),1.20,19:00,2:1,2025-05-28,,N/A,ctuuehpb91135781,bet99_draws
