Turkey - Süper Lig,Adana Demirspor vs Besiktas,Over 2.5 Goals,1.53,,,18:00,2024-12-16,"data:image/svg+xml,%3Csvg%20xmlns='http://www.w3.org/2000/svg'%20viewBox='0%200%2064%2064'%3E%3C/svg%3E",https://betinum.com/wp-content/uploads/2018/07/adana-demirspor1.jpg,https://betinum.com/wp-content/uploads/2018/06/besiktash.png,3/5,"Adana Demirspor has a terrible defense, conceding 34 goals in 14 games so far, averaging 2.43 per game.Furthermore, they have conceded three or more goals in three of their last four games.Besiktas is also not solid defensively and has kept a clean sheet only once in their last five games.In the last three direct meetings between the teams, three or more goals have been scored in two of the matches.This makes the likelihood of a high-scoring match very high.",betnum,lvhlcduf315293095
Turkey - Süper Lig,Galatasaray vs Trabzonspor,Both Teams to Score,1.53,,,20:00,2024-12-16,"data:image/svg+xml,%3Csvg%20xmlns='http://www.w3.org/2000/svg'%20viewBox='0%200%2064%2064'%3E%3C/svg%3E",https://betinum.com/wp-content/uploads/2018/07/galatasaray.png,https://betinum.com/wp-content/uploads/2018/07/trabzonspor.png,4/5,"Both teams are expected to score in the match between Galatasaray and Trabzonspor due to the weak defense of both teams.Galatasaray, despite its strong offense and no loss so far in the season, has not been solid on defense, conceding only one goal in the last nine games.Trabzonspor has also had problems defensively, having recorded just two clean sheets in the last nine games and in seven of those both teams scored.So, in view of these trends, both teams are likely to score.",betnum,vbwclrhb190043588
Italy - Seria A,Lazio vs Inter,Both Teams to Score,1.75,,,21:45,2024-12-16,"data:image/svg+xml,%3Csvg%20xmlns='http://www.w3.org/2000/svg'%20viewBox='0%200%2064%2064'%3E%3C/svg%3E",https://betinum.com/wp-content/uploads/2018/07/lazio.png,https://betinum.com/wp-content/uploads/2020/12/internazionale_corpo.png,4/5,"We expect both teams to score in the match between Lazio and Inter due to Lazio's strong offense and Inter's tendency to concede at least one goal against them.Lazio regularly score at least one goal at home, having done so in 22 of their last 23 home games.On the other hand, Inter, despite their solid defense, has conceded a goal against this opponent in 4 of the last 5 meetings between the two teams.",betnum,kshnwaty296845872
England - Premier League,Bournemouth vs West Ham United,Bournemouth to win,1.72,,,22:00,2024-12-16,https://betinum.com/wp-content/uploads/2021/05/england.png,https://betinum.com/wp-content/uploads/2018/06/bournemouth.png,https://betinum.com/wp-content/uploads/2018/06/West-Ham.png,4/5,"Bournemouth look very strong in the current season, having won their last three games and are in good form, with 24 points in 15 rounds.They are very strong at home, winning 4 of their last 5 games on home turf.On the other hand, West Ham have problems away, having lost three of their last four away games.Also, the quality between the two teams is quite different and favours Bournemouth.",betnum,lstveywm154544279
Denmark - DBU Pokalen,Aalborg vs Silkeborg,Under 3.5 Goals,1.44,,,20:00,2024-12-16,"data:image/svg+xml,%3Csvg%20xmlns='http://www.w3.org/2000/svg'%20viewBox='0%200%2064%2064'%3E%3C/svg%3E",https://betinum.com/wp-content/uploads/2018/07/aalborg.png,https://betinum.com/wp-content/uploads/2018/07/silkeborg.png,3/5,"The first match ended in a 2-2 draw, but in this rematch both teams will approach with more caution, avoiding risks in attack.Silkeborg have had games with few goals lately, with only one of their last six games having more than two goals.Aalborg also have problems in attack, having not scored in their last two league games.These factors, along with the importance of advancing to the next round, make it unlikely that we will see goals in this match.",betnum,cvpuunss203256299
Portugal - Primeira,Sporting Braga vs Famalicao,Half Time / Full Time - Braga / Braga,2.30,,,20:45,2024-12-16,"data:image/svg+xml,%3Csvg%20xmlns='http://www.w3.org/2000/svg'%20viewBox='0%200%2064%2064'%3E%3C/svg%3E",https://betinum.com/wp-content/uploads/2018/07/sporting-braga.png,https://betinum.com/wp-content/uploads/2018/07/Famalicao.png,3/5,"Braga have a solid record at home with seven wins from their last 11 games at the Estádio Municipal de Braga despite some problems in defence.They have scored in most of their home games, while Famalicao has had consistency problems on the road, going winless in their last four games.The quality of the home side is much better and we expect them to win convincingly.",betnum,iikwqomq162193500
Portugal - Primeira,Porto vs Estrela Amadora,Half Time / Full Time - Porto / Porto,1.61,,,22:15,2024-12-16,"data:image/svg+xml,%3Csvg%20xmlns='http://www.w3.org/2000/svg'%20viewBox='0%200%2064%2064'%3E%3C/svg%3E",https://betinum.com/wp-content/uploads/2018/07/porto.png,https://betinum.com/wp-content/uploads/2020/12/1200px-Simbolo_Estrela_da_Amadora.svg_.png,3/5,"Porto are in magnificent form at home, winning all seven of their league games, five of them by at least two goals.On the other hand, Estrela are winless in their last 19 away games in the Premeira Liga and have serious problems in attack, having scored just one goal in their last five away games.We expect Porto to beat their opponent very easily today.",betnum,ogutxnqr29592504
