AUSTR. D1,CC Mariners vs Adelaide United,BTTS,1.50,09:35,N/A,2024-12-13,,N/A,pabmxvof224784478,safertip_btts
IND. D2,SC Bengaluru vs Delhi FC,BTTS,1.54,11:00,N/A,2024-12-13,,N/A,cfxvtmkg176835151,safertip_btts
JOR Cup,Ramtha SC vs Al Jazeera Club,BTTS,1.60,14:00,N/A,2024-12-13,,N/A,yibujtub9736101,safertip_btts
IND. D2,Deccan FC vs Dempo SC,BTTS,1.63,14:30,N/A,2024-12-13,,N/A,lolxpetx146588682,safertip_btts
IND. D1,Jamshedpur FC vs Punjab FC,BTTS,1.55,15:00,N/A,2024-12-13,,N/A,hnwpzhyf156436127,safertip_btts
BAH D1,Al Shabab FC vs Sitra Club,BTTS,1.67,17:00,N/A,2024-12-13,,N/A,ijpqbmkw260262669,safertip_btts
TURK D1,Kasimpasa vs Eyupspor,BTTS,1.58,18:00,N/A,2024-12-13,,N/A,oyjyvliq55553877,safertip_btts
