11:00,S.KOR D1,Pohang Steelers vs Gwangju FC,U3.5,1.24,N/A,N/A,safertip,2025-08-10
11:00,S.KOR D1,Daejeon FC vs Suwon FC,Over1.5,1.22,N/A,N/A,safertip,2025-08-10
11:15,NED Eredivisie,PEC Zwolle vs FC Twente,X2,1.28,N/A,N/A,safertip,2025-08-10
11:15,NED D2,Helmond Sport vs Roda JC,BTTS,1.47,N/A,N/A,safertip,2025-08-10
12:00,IRE D1,St Patricks Athletic vs Sligo Rovers,1,1.40,N/A,N/A,safertip,2025-08-10
12:00,CHN 1,Tianjin Jinmen vs Qingdao West Coast,Over1.5,1.21,N/A,N/A,safertip,2025-08-10
12:00,INT Club FRL,Buriram United vs Rayong FC,Over2.5,1.27,N/A,N/A,safertip,2025-08-10
12:30,GER D2,VFL Bochum vs SV Elversberg,Over1.5,1.19,N/A,N/A,safertip,2025-08-10
12:30,GER D2,Holstein Kiel vs Arminia Bielefeld,BTTS,1.51,N/A,N/A,safertip,2025-08-10
12:30,SCT D1,Aberdeen FC vs Celtic FC,2,1.40,N/A,N/A,safertip,2025-08-10
12:30,BELG D1,Raal La Louviere vs Charleroi SC,X2,1.33,N/A,N/A,safertip,2025-08-10
12:30,BELA D1,FC Gomel vs Neman Grodno,2,1.53,N/A,N/A,safertip,2025-08-10
12:35,CHN 1,Zhejiang FC vs Beijing Guoan,BTTS,1.39,N/A,N/A,safertip,2025-08-10
13:00,CHN 1,Wuhan Three Towns vs Meizhou Hakka,1X,1.23,N/A,N/A,safertip,2025-08-10
13:00,SWE D1,AIK vs Djugardens IF,U3.5,1.19,N/A,N/A,safertip,2025-08-10
13:00,SWE D1,Degerfors IF vs BK Hacken,BTTS,1.51,N/A,N/A,safertip,2025-08-10
13:00,DEN D1,FC Midtjylland vs FC Fredericia,1,1.35,N/A,N/A,safertip,2025-08-10
13:00,SWT D1,Young Boys vs FC Sion,1,1.56,N/A,N/A,safertip,2025-08-10
13:00,CHAN,Kenya vs Morocco,X2,1.22,N/A,N/A,safertip,2025-08-10
13:30,NED Eredivisie,AZ Alkamaar vs FC Groningen,1,1.49,N/A,N/A,safertip,2025-08-10
13:30,NED Eredivisie,Ajax vs SC Telstar,Over2.5,1.32,N/A,N/A,safertip,2025-08-10
13:30,GER D2,Hertha BSC vs Karlsruher SC,1X,1.24,N/A,N/A,safertip,2025-08-10
14:00,CZE D1,Bohemians 1905 vs FK Jablonec,Away Over0.5,1.26,N/A,N/A,safertip,2025-08-10
14:00,CZE D1,FC Hradec Kralove vs FK Pardubice,1,1.41,N/A,N/A,safertip,2025-08-10
14:30,BELA D1,FC Brest vs Naftan Novopolotsk,1,1.30,N/A,N/A,safertip,2025-08-10
14:30,SWE D1,Osters IF vs IF Brommapojkarna,Over1.5,1.19,N/A,N/A,safertip,2025-08-10
15:00,Community Shield,Crystal Palace vs Liverpool,X2,1.18,N/A,N/A,safertip,2025-08-10
15:00,SCT D1,Hibernian FC vs Kilmarnock FC,1X,1.20,N/A,N/A,safertip,2025-08-10
15:00,SCT D1,Dundee United vs Hearts FC,X2,1.27,N/A,N/A,safertip,2025-08-10
15:00,BELG D1,RSC Anderlecht vs SV Zulte Waregem,1,1.44,N/A,N/A,safertip,2025-08-10
15:00,DEN D1,Silkeborg IF vs FC Nordsjælland,12,1.28,N/A,N/A,safertip,2025-08-10
15:00,ICE D1,IF Vestri vs Fram Reykjavik,Over1.5,1.20,N/A,N/A,safertip,2025-08-10
15:00,N.IRE D1,Bangor FC vs Clifftonville FC,2,1.45,N/A,N/A,safertip,2025-08-10
15:00,N.IRE D1,Coleraine FC vs Larne FC,1X,1.18,N/A,N/A,safertip,2025-08-10
15:00,N.IRE D1,Linfield FC vs Dungannon Swifts,1,1.46,N/A,N/A,safertip,2025-08-10
15:00,INT Club FRL,Chelsea FC vs AC Milan,Over2.5,1.39,N/A,N/A,safertip,2025-08-10
15:30,SWE D1,IFK Norrkoping vs Hammarby IF,X2,1.19,N/A,N/A,safertip,2025-08-10
15:30,SWT D1,Lausanne Sport vs FC Zurich,1X,1.26,N/A,N/A,safertip,2025-08-10
15:30,SWT D1,Servette vs Grasshoppers FC,12,1.25,N/A,N/A,safertip,2025-08-10
15:30,SWT D1,FC Lugano vs FC Basel,X2,1.31,N/A,N/A,safertip,2025-08-10
15:45,NED Eredivisie,FC Utrecht vs Heracles,1,1.54,N/A,N/A,safertip,2025-08-10
15:45,NED D2,ADO Den Haag vs Willem II,Over1.5,1.18,N/A,N/A,safertip,2025-08-10
16:00,AUST D1,Austria Vienna vs Wolfsberger AC,Over1.5,1.24,N/A,N/A,safertip,2025-08-10
16:00,AUST D1,WSG Tirol vs LASK Linz,X2,1.30,N/A,N/A,safertip,2025-08-10
16:00,AUST D1,SK Sturm Graz vs Rapid Vienna,BTTS,1.55,N/A,N/A,safertip,2025-08-10
16:00,EGY PL,Kahrabaa Ismailia vs El Gouna FC,U2.5,1.43,N/A,N/A,safertip,2025-08-10
16:00,NOR D1,FK Haugesund vs Sarpsborg 08,2,1.50,N/A,N/A,safertip,2025-08-10
16:00,NOR D1,Bryne FK vs KFUM Olso,U3.5,1.25,N/A,N/A,safertip,2025-08-10
16:00,CHAN,Zambia vs Angola,U3.5,1.16,N/A,N/A,safertip,2025-08-10
16:30,ENG CH,Leicester City vs Sheffield Wednesday,Over2.5,1.47,N/A,N/A,safertip,2025-08-10
16:30,BELA D1,FK Dzerszhinsk vs Maxline Vitebsk,X2,1.17,N/A,N/A,safertip,2025-08-10
16:30,CZE D1,Banik Ostrava vs MFK Karvina,1X,1.18,N/A,N/A,safertip,2025-08-10
16:30,ROM D1,CS Universitatae Craiova vs AFC Hermannstadt,1X,1.18,N/A,N/A,safertip,2025-08-10
16:30,INT Club FRL,Borussia Dortmund vs Juventus,BTTS,1.43,N/A,N/A,safertip,2025-08-10
16:30,INT Club FRL,FC Arzignano vs AC Carpi,1X,1.29,N/A,N/A,safertip,2025-08-10
16:30,INT Club FRL,FC Aarau vs Al Hilal SC,2/2,1.39,N/A,N/A,safertip,2025-08-10
16:30,INT Club FRL,Sunderland vs Rayo Vallecano,Over1.5,1.18,N/A,N/A,safertip,2025-08-10
16:30,POL D1,Jagiellonia vs MKS Cracovia,Over1.5,1.19,N/A,N/A,safertip,2025-08-10
17:00,POR D1,FC Famalicao vs Santa Clara,U3.5,1.17,N/A,N/A,safertip,2025-08-10
17:00,IRE D1,Galway United vs Shamrock Rovers,X2,1.23,N/A,N/A,safertip,2025-08-10
17:00,BULG D1,Levski Sofia vs FK Spartak Varna,1 - Over1.5,1.27,N/A,N/A,safertip,2025-08-10
17:00,DEN D1,Brondby IF vs Vejle BK,1X,1.22,N/A,N/A,safertip,2025-08-10
17:00,TURK D1,Rizespor vs Goztepe Izmir,Home Over0.5,1.21,N/A,N/A,safertip,2025-08-10
17:30,BELG D1,Standard Liege vs KRC Genk,X2,1.23,N/A,N/A,safertip,2025-08-10
17:30,ICE D1,KA Akureyri vs IBV Vestmannaeyjar,BTTS,1.55,N/A,N/A,safertip,2025-08-10
18:00,INT Club FRL,Toulouse vs Sevilla,BTTS,1.64,N/A,N/A,safertip,2025-08-10
18:15,BELG D1,Royal Antwerp vs OH Leuven,1X,1.24,N/A,N/A,safertip,2025-08-10
18:15,NOR D1,Sandefjord vs Viking FK,BTTS,1.40,N/A,N/A,safertip,2025-08-10
18:30,BELA D1,Dinamo Minsk vs Torpedo Zhodino,U3.5,1.16,N/A,N/A,safertip,2025-08-10
18:55,BELA D1,FC Vitebsk vs Dinamo Minsk,1X,1.26,N/A,N/A,safertip,2025-08-10
19:00,ARG 1,Barracas Central vs CA Aldosivi,1X,1.26,N/A,N/A,safertip,2025-08-10
19:00,CZE D1,Sparta Prague vs SK Sigma Olomouc,1,1.33,N/A,N/A,safertip,2025-08-10
19:00,EGY PL,Pharco FC vs ENPPI Cairo,U2.5,1.34,N/A,N/A,safertip,2025-08-10
19:00,EGY PL,NBE SC vs Ghazi El Mahalla,1X,1.22,N/A,N/A,safertip,2025-08-10
19:00,INT Club FRL,Modena FC vs Forli FC,Over2.5,1.36,N/A,N/A,safertip,2025-08-10
19:00,INT Club FRL,US Salernitana vs Reggiana 1919,1,1.18,N/A,N/A,safertip,2025-08-10
19:00,SER D1,FK Radnicki Nis vs FK Novi Pazar,1X,1.28,N/A,N/A,safertip,2025-08-10
19:15,BULG D1,Botev Plovdiv vs Lokomotiv Sofia,1X,1.28,N/A,N/A,safertip,2025-08-10
19:15,POL D1,Legia Warszawa vs GKS Katowice,1,1.37,N/A,N/A,safertip,2025-08-10
19:30,ROM D1,FCSB vs FC Unirea 2004,1,1.35,N/A,N/A,safertip,2025-08-10
19:30,TURK D1,Eyupspor vs Konyaspor,Home Over0.5,1.27,N/A,N/A,safertip,2025-08-10
19:30,SER D1,FK Napredak vs Partizani Belgrade,X2,1.18,N/A,N/A,safertip,2025-08-10
20:00,BRA 1,Palmeiras SP vs Ceara SC,1,1.48,N/A,N/A,safertip,2025-08-10
20:00,BRA 1,Vasco da Gama RJ vs Atletico Mineiro MG,U3.5,1.17,N/A,N/A,safertip,2025-08-10
20:00,INT Club FRL,FC Barcelona vs Como,1,1.25,N/A,N/A,safertip,2025-08-10
20:00,INT Club FRL,Villarreal vs Aston Villa,BTTS,1.49,N/A,N/A,safertip,2025-08-10
20:15,ICE D1,Vikingur Reykjavik vs Stjarnan,BTTS,1.50,N/A,N/A,safertip,2025-08-10
20:15,ICE D1,Valur Reykjavik vs Breidablik Kopavogur,Over2.5,1.48,N/A,N/A,safertip,2025-08-10
20:30,POR D1,SC Braga vs CD Tondela,1,1.36,N/A,N/A,safertip,2025-08-10
20:30,POR D1,Moreirense FC vs FC Alverca,1X,1.27,N/A,N/A,safertip,2025-08-10
21:00,ARG 1,Instituto Cordoba vs CA Platense,1X,1.26,N/A,N/A,safertip,2025-08-10
21:00,COL 1,Envigado FC vs CD Junior FC,X2,1.28,N/A,N/A,safertip,2025-08-10
