"Bolivia, Plurinational State of",The Strongest vs ABB,Over 1.5,1.45,23:00,N/A,2025-05-26,BO,N/A,pyrsjhfa171489613,safertip_over_15
MLS,Atlanta United vs FC Cincinnati,Over 1.5,1.30,00:00,N/A,2025-05-26,,N/A,agzmncrf133408227,safertip_over_15
"Bolivia, Plurinational State of",Guabira vs Oriente Petrolero,Over 1.5,1.45,00:30,N/A,2025-05-26,BO,N/A,ycxxcsyh243515004,safertip_over_15
BAH D1,Al Riffa vs Bahrain SC,Over 1.5,1.30,17:00,N/A,2025-05-26,,N/A,wfumzbyk179745236,safertip_over_15
BAH D1,Aali Club vs Al Muharraq SC,Over 1.5,1.35,17:00,N/A,2025-05-26,,N/A,rjkfmtuu151254747,safertip_over_15
Sweden,IFK Norrkoping vs Mjallby AIF,Over 1.5,1.35,18:00,N/A,2025-05-26,SE,N/A,dgsmshoh326856985,safertip_over_15
Turkey,Hatayspor vs Fenerbache,Over 1.5,1.30,18:00,N/A,2025-05-26,TR,N/A,luvigjev322765597,safertip_over_15
Sweden,Umea FC vs Orgryte IS,Over 1.5,1.27,18:00,N/A,2025-05-26,SE,N/A,zpzbgunu168404306,safertip_over_15
Sweden,Hammarby FF vs Degerfors IF,Over 1.5,1.20,18:10,N/A,2025-05-26,SE,N/A,tmpvgfgs246500524,safertip_over_15
