ISR,Hapoel Bnei Zalfa vs Tzeirei Kafr Kanna,Under 3.5,N/A,14:00,,2024-03-19,,N/A,mhgquqbw92597939,venasbet_u_3_5
GRE,Panelefsiniakos vs PAO Varda,Under 3.5,N/A,14:00,,2024-03-19,,N/A,vhnwifcb180997470,venasbet_u_3_5
ITA C,Potenza vs Picerno,Under 3.5,N/A,N/A,1:0,2024-03-18,,Won,bqycqukm79962820,venasbet_u_3_5
ISR,MS Kafr Qasim vs Ironi Tiberias,Under 3.5,N/A,N/A,1:2,2024-03-18,,Won,clwrqryz312792194,venasbet_u_3_5
ISR,Ihud Bnei Shfaram vs M. Herzliya,Under 3.5,N/A,N/A,0:2,2024-03-18,,Won,idxopkix3870764,venasbet_u_3_5
FRA NAT,Villefranche vs Red Star,Under 3.5,N/A,N/A,0:2,2024-03-18,,Won,fmvjjhfz308192012,venasbet_u_3_5
