GHA,Real Tamale vs Bibiani Gold Stars,Under 3.5,N/A,16:00,,2024-03-14,,N/A,vgustxjr276682435,venasbet_u_3_5
AZE,Iravan vs Zaqatala,Under 3.5,N/A,10:00,,2024-03-14,,N/A,ibvsrrwz130545123,venasbet_u_3_5
ALG,El Bayadh U21 vs Saoura U21,Under 3.5,N/A,15:30,,2024-03-14,,N/A,tffqfyzq172955419,venasbet_u_3_5
LIT,Hegelmann vs Siauliai FA,Under 3.5,N/A,N/A,2:2,2024-03-13,,...,qzysrcby204866116,venasbet_u_3_5
INDO PL,Persebaya vs Madura United,Under 3.5,N/A,N/A,0:0,2024-03-13,,...,npyplffr25644448,venasbet_u_3_5
IND,Lajong vs Real Kashmir,Under 3.5,N/A,N/A,1:1,2024-03-13,,...,pnojmiou18882377,venasbet_u_3_5
ARG,Central Cordoba vs Belgrano,Under 3.5,N/A,N/A,2:2,2024-03-13,,...,tzfpwprj69284359,venasbet_u_3_5
UCL,Atl. Madrid vs Inter,Under 3.5,N/A,N/A,2:1,2024-03-13,,...,uarszqir11112194,venasbet_u_3_5
